Category,Question,Answer
모젠서비스,보증 수리기간이 어떻게 되나요?,"모젠 단말기의 보증수리 기간은 구입한 신차의 보증 내용 및 규약에 종속됩니다. 현대자동차의 보증수리 기간은 차종, 동력전달장치, 일반부품 등에 따라 차이가 있으며, 모젠 단말기는 일반부품의 보증기간에 따릅니다."
모젠서비스,ACC ON시에 바로 화면이 표시되지 않습니다.,"모젠 단말기는 ACC OFF시에 단말기의 전원을 바로 끄지 않고, 수 초 동안 상태를 확인 하고 종료합니다. 따라서 이 동안에 ACC OFF/ON을 반복하는 경우 단말의 전원종료 후 재가동이 지연되어 수초의 동작 지연 현상이 나타날 수 있습니다. 잠시만 기다리시면 됩니다."
모젠서비스,"사용도중 단말기가 갑자기 중지되거나, 버튼을 입력해도 말을 듣지 않습니다.","모젠은 차량용 컴퓨터로 개발되었으며, 각종 AV와 이동전화, 내비게이션 시스템과 텔레매틱스의 각 기능이 중앙처리장치(CPU)와 운영시스템(OS)에 의해서 운영되도록 개발되었습니다. 따라서, 작동 중에 소프트웨어의 충돌이 발생하거나 프로그램의 원할한 처리가 이루어지지 않는 경우, 아주 간헐적으로 단말기가 일시적으로 동작이 중지되는 경우가 발생할 수 있습니다. 이는 고장이나 단말기 시스템의 하자는 아니며, 리셋버튼을 누르시면 다시 이용하실 수 있습니다. 단말기 오른쪽 하단에 있는 리셋버튼을 누르시면 다시 작동이 가능합니다."
모젠서비스,단말기 모델 및 일련번호는 어디서 확인하나요?,단말기 `INFO` 버튼 → `환경 설정` 선택 → `단말기 정보` 선택
모젠서비스,모젠 서비스에 오류가 있을 때에는 어떻게 하나요?,모젠고객센터(080-600-6000)로 문의 주시거나 1:1상담 문의에 올려주시면 신속하게 지원해 드리겠습니다.
모젠서비스,보증 수리기간이 어떻게 되나요?,"모젠 단말기의 보증수리 기간은 구입한 신차의 보증 내용 및 규약에 종속됩니다. 현대자동차의 보증수리 기간은 차종, 동력전달장치, 일반부품 등에 따라 차이가 있으며, 모젠 단말기는 일반부품의 보증기간에 따릅니다."
모젠서비스,ACC ON시에 바로 화면이 표시되지 않습니다.,"모젠 단말기는 ACC OFF시에 단말기의 전원을 바로 끄지 않고, 수 초 동안 상태를 확인 하고 종료합니다. 따라서 이 동안에 ACC OFF/ON을 반복하는 경우 단말의 전원종료 후 재가동이 지연되어 수초의 동작 지연 현상이 나타날 수 있습니다. 잠시만 기다리시면 됩니다."
모젠서비스,"사용도중 단말기가 갑자기 중지되거나, 버튼을 입력해도 말을 듣지 않습니다.","모젠은 차량용 컴퓨터로 개발되었으며, 각종 AV와 이동전화, 내비게이션 시스템과 텔레매틱스의 각 기능이 중앙처리장치(CPU)와 운영시스템(OS)에 의해서 운영되도록 개발되었습니다. 따라서, 작동 중에 소프트웨어의 충돌이 발생하거나 프로그램의 원할한 처리가 이루어지지 않는 경우, 아주 간헐적으로 단말기가 일시적으로 동작이 중지되는 경우가 발생할 수 있습니다. 이는 고장이나 단말기 시스템의 하자는 아니며, 리셋버튼을 누르시면 다시 이용하실 수 있습니다. 단말기 오른쪽 하단에 있는 리셋버튼을 누르시면 다시 작동이 가능합니다."
모젠서비스,단말기 모델 및 일련번호는 어디서 확인하나요?,단말기 `INFO` 버튼 → `환경 설정` 선택 → `단말기 정보` 선택
모젠서비스,모젠 서비스에 오류가 있을 때에는 어떻게 하나요?,지도 화면 좌측 상단에 있는 `확성기` 모양의 아이콘을 선택하면 안내음이 나오지 않습니다. 다시 음성안내를 듣고자 하시면 아이콘을 다시 한번 선택하시면 됩니다.
모젠서비스,GPS 수신이 안됩니다. 어떻게 하나요?,"기본적으로 시동을 켠 후 약몇분동안 GPS인식되는 시간소요가 필요합니다. 그리고, GPS위성에서 발송하는 전파의 특성 상 고가 밑, 지하차도, 도심 건물 밀집 지역 등 GPS 수신 안테나가 가려지는 경우 수신 불량 상태가 발생 할 수 있습니다. 따라서 장애물이 없는 위치로 차량이 이동되면 GPS 수신 기능이 정상적으로 작동하게 됩니다. 만약 개활지 상태에서도 위성수신 상태가 불량하면 A/S망을 이용하여 GPS 수신 장치의 정비를 받으셔야 합니다."
모젠서비스,내비게이션의 지도 업그레이드는 어떻게 하나요?,모젠 지도 업그레이드는 차량용 A/V 및 내비게이션 A/S를 담당하고 있는 현대 웰슨에서 수행하고 있습니다.  전국 현대자동차 23개 하이테크센터와 기아자동차 11개 직영서비스 센터에서 현대 웰슨 A/S요원이 상주 근무하고 있으며 전국 115개소의 현대 웰슨 협력점에서 지도 업그레이드가 가능합니다.  모젠고객센터 080-600-6000으로 전화주시면 지도 업그레이드 상담이 가능하며 업그레이드 가능한 가까운 서비스센터에 대한 안내를 받으실 수 있습니다.
모젠서비스,단말기만 별도로 충전을 해줘야 하나요?,"차량의 배터리와 연결되어 있으며, 별도의 충전은 필요없습니다."
모젠서비스,단말기의 벨소리를 다운로드 받을 수 있나요?,불가능 합니다. 단말기내에 이미 저장된 벨소리 중에서만 선택변경 하실 수 있습니다.
블루링크,[서비스] 라이트 서비스가 무엇인가요?,"블루링크 5년 무료+ 요금제 무료 기간 만료 이후 추가 5년 동안 차량 안전과 연관된 SOS 긴급 출동, 에어백 전개 자동 통보, 교통정보, 전기차 배터리 모니터링을 제공하는 서비스 입니다."
블루링크,[서비스] 블루링크 5년 무료 + 요금제 무료 기간 만료 이후 라이트 서비스 이용을 위해 별도 가입이 필요한가요?,블루링크 5년 무료 기간 만료 후 라이트 서비스로 자동 전환되므로 별도 가입이 불필요 합니다.
블루링크,"[서비스] 라이트 서비스 전환 이후 원격 제어, 뮤직 스트리밍 등 블루링크 전체 서비스를 이용하려면 어떻게 해야 하나요?",마이현대 앱 홈 화면 내 블루링크 가입 또는 마이현대 로그인 > 하단 메뉴바 [마이] 선택 > [차량 관리] 선택 > [블루링크] 메뉴에서 유료전환을 신청하시면 전체 서비스 이용이 가능합니다.
블루링크,[서비스] 블루링크를 가입하면 어떤 서비스가 제공되나요?,"블루링크를 가입하시면 차량 원격제어, 안전보안, 차량관리, 길 안내 서비스를 제공받으실 수 있습니다. 블루링크 자세한 서비스 안내는 아래 페이지를 참고해주세요.  블루링크 서비스 안내 ▶바로가기"
블루링크,[A/S] 블루링크 서비스 이용 시 오류가 발생합니다.,블루링크 고객센터 또는 홈페이지 1:1문의에 문의해 주시면 신속하게 지원해 드리겠습니다.  블루링크 고객센터 080-600-6000 서비스 가입/해지/변경 등 (안전 보안 서비스 24시간 제공) 평일 08:30 ~ 18:00 (주말/공휴일 휴무)
블루링크,[서비스] 라이트 서비스가 무엇인가요?,"블루링크 5년 무료+ 요금제 무료 기간 만료 이후 추가 5년 동안 차량 안전과 연관된 SOS 긴급 출동, 에어백 전개 자동 통보, 교통정보, 전기차 배터리 모니터링을 제공하는 서비스 입니다."
블루링크,[서비스] 블루링크 5년 무료 + 요금제 무료 기간 만료 이후 라이트 서비스 이용을 위해 별도 가입이 필요한가요?,블루링크 5년 무료 기간 만료 후 라이트 서비스로 자동 전환되므로 별도 가입이 불필요 합니다.
블루링크,"[서비스] 라이트 서비스 전환 이후 원격 제어, 뮤직 스트리밍 등 블루링크 전체 서비스를 이용하려면 어떻게 해야 하나요?",마이현대 앱 홈 화면 내 블루링크 가입 또는 마이현대 로그인 > 하단 메뉴바 [마이] 선택 > [차량 관리] 선택 > [블루링크] 메뉴에서 유료전환을 신청하시면 전체 서비스 이용이 가능합니다.
블루링크,[서비스] 블루링크를 가입하면 어떤 서비스가 제공되나요?,"블루링크를 가입하시면 차량 원격제어, 안전보안, 차량관리, 길 안내 서비스를 제공받으실 수 있습니다. 블루링크 자세한 서비스 안내는 아래 페이지를 참고해주세요.  블루링크 서비스 안내 ▶바로가기"
블루링크,[A/S] 블루링크 서비스 이용 시 오류가 발생합니다.,블루링크 고객센터 또는 홈페이지 1:1문의에 문의해 주시면 신속하게 지원해 드리겠습니다.  블루링크 고객센터 080-600-6000 서비스 가입/해지/변경 등 (안전 보안 서비스 24시간 제공) 평일 08:30 ~ 18:00 (주말/공휴일 휴무)
블루링크,[서비스] 라이트 서비스가 무엇인가요?,"블루링크 5년 무료+ 요금제 무료 기간 만료 이후 추가 5년 동안 차량 안전과 연관된 SOS 긴급 출동, 에어백 전개 자동 통보, 교통정보, 전기차 배터리 모니터링을 제공하는 서비스 입니다."
블루링크,[서비스] 블루링크 5년 무료 + 요금제 무료 기간 만료 이후 라이트 서비스 이용을 위해 별도 가입이 필요한가요?,블루링크 5년 무료 기간 만료 후 라이트 서비스로 자동 전환되므로 별도 가입이 불필요 합니다.
블루링크,"[서비스] 라이트 서비스 전환 이후 원격 제어, 뮤직 스트리밍 등 블루링크 전체 서비스를 이용하려면 어떻게 해야 하나요?","고객님의 안전한 운행을 위해 주행 중에는 단말기 조작을 제한하고 있으며, 기어가 P단일 경우만 조작이 가능합니다. 시스템 조작을 통해 서비스를 이용하시려면 차량을 잠시 정차해 주세요. 단, 조작이 간단한 일부 서비스는 주행 중에도 사용이 가능합니다."
블루링크,[요금제] 블루링크 유료 요금제가 어떻게 되나요?,블루링크 자세한 요금제 안내는 아래 페이지를 참고해주세요.  블루링크 요금제 안내 ▶바로가기
블루링크,[요금제] 요금 미납을 했을 경우 가산금은 몇%인가요?,요금 미납 시 가산금은 당월 청구금액의 2%입니다.
블루링크,[A/S] 원격 공조 제어 서비스를 사용했는데 계속 비상등이 켜져 깜박입니다.,원격 공조 제어 서비스 이용시 비상등이 함께 켜지는 것은 정상적인 현상입니다. 스마트키로 차량의 문을 여닫으실 때 비상등이 깜빡이는 것과 동일합니다. 또한 도로 안전상의 이유로 시동이 켜져 있다는 것을 외부에서도 확인할 수 있도록 시동과 비상등이 함께 작동됩니다.
블루링크,[A/S] GPS 수신이 안됩니다.,"시동을 켠 후 수 분 동안 GPS가 인식되는 시간이 필요합니다. 혹은 GPS위성에서 발송하는 전파의 특성상 고가 밑, 지하차도, 도심 건물 밀집지역 등 GPS 수신 안테나가 가려지는 경우 수신 불량 상태가 발생 할 수 있습니다. 이 경우 장애물이 없는 위치로 차량을 이동하시면 GPS 수신 기능이 정상적으로 작동하게 됩니다. 만약 개방된 지역에서도 위성수신 상태가 불량하면 A/S를 통해 GPS 수신 장치의 정비를 받으시기 바랍니다."
블루링크,[A/S] 주행 중에 시스템 조작이 안됩니다.,블루링크는 블루링크 앱 또는 내비게이션(내비게이션 가입은 출고 후 1년 이내 최초 개통 시)으로 가입하실 수 있습니다. 자세한 가입 안내는 아래 페이지를 참고해주세요.  블루링크 서비스 가입 안내 ▶바로가기
블루링크,[가입] 중고차를 구입했는데 블루링크에 가입할 수 있나요?,"중고차 구매 후 블루링크 가입 시 유료로 이용 또는 무료 기간 승계가 가능하신 경우 무료 기간이 제공됩니다. 블루링크 요금제에 따라 무료 기간 승계 가능여부가 다르므로, 자세한 차종별 요금제안내는 아래 페이지를 참고해주세요. ※ 블루링크 차종별 요금제 안내 ▶바로가기  중고차 구매 시 마이현대 앱으로 가입하실 수 있습니다. 자세한 가입 안내는 아래 페이지를 참고해주세요. ※ 블루링크 서비스 가입 안내 ▶바로가기"
블루링크,[해지] 블루링크를 해지하고 싶습니다.,블루링크 해지는 아래 모바일 페이지 또는 블루링크 고객센터에서 가능합니다. 해지 모바일 페이지 ▶바로가기  블루링크 고객센터 080-600-6000 서비스 가입/해지/변경 등 (안전 보안 서비스 24시간 제공) 평일 08:30 ~ 18:00 (주말/공휴일 휴무)
블루링크,[요금제] 요금제 납부 방식을 변경하고 싶습니다.,블루링크 요금제 납부 방법 조회 및 변경은 아래 모바일 페이지 또는 블루링크 고객센터에서 가능합니다. ※ 법인/리스/렌트 차량은 블루링크 고객센터에서 처리 가능  요금제 납부 방법 조회 및 변경 모바일 페이지 ▶바로가기  - 블루링크 고객센터 080-600-6000 - 서비스 가입/해지/변경 등 (안전 보안 서비스 24시간 제공) - 평일 08:30 ~ 18:00 (주말/공휴일 휴무)
블루링크,[요금제] 사용 중인 블루링크 요금제가 궁금합니다.,블루링크 자세한 차종별 요금제 안내는 아래 페이지를 참고해주세요.  블루링크 차종별 요금제 안내 ▶바로가기
블루링크,[가입] 블루링크는 어떻게 가입하나요?,블루링크는 블루링크 앱 또는 내비게이션(내비게이션 가입은 출고 후 1년 이내 최초 개통 시)으로 가입하실 수 있습니다. 자세한 가입 안내는 아래 페이지를 참고해주세요.  블루링크 서비스 가입 안내 ▶바로가기
블루링크,[가입] 중고차를 구입했는데 블루링크에 가입할 수 있나요?,"중고차 구매 후 블루링크 가입 시 유료로 이용 또는 무료 기간 승계가 가능하신 경우 무료 기간이 제공됩니다. 블루링크 요금제에 따라 무료 기간 승계 가능여부가 다르므로, 자세한 차종별 요금제안내는 아래 페이지를 참고해주세요. ※ 블루링크 차종별 요금제 안내 ▶바로가기  중고차 구매 시 마이현대 앱으로 가입하실 수 있습니다. 자세한 가입 안내는 아래 페이지를 참고해주세요. ※ 블루링크 서비스 가입 안내 ▶바로가기"
블루링크,[해지] 블루링크를 해지하고 싶습니다.,블루링크 해지는 아래 모바일 페이지 또는 블루링크 고객센터에서 가능합니다. 해지 모바일 페이지 ▶바로가기  블루링크 고객센터 080-600-6000 서비스 가입/해지/변경 등 (안전 보안 서비스 24시간 제공) 평일 08:30 ~ 18:00 (주말/공휴일 휴무)
블루링크,[해지] 블루링크 가입 차량을 매각하면 자동으로 해지되나요?,블루링크 가입 차량을 매각하신 경우 반드시 블루링크 서비스를 해지하셔야 합니다. 블루링크 서비스를 해지하지 않으시면 계속 서비스 이용요금이 부과됩니다. 블루링크 해지는 아래 모바일 페이지 또는 블루링크 고객센터에서 가능합니다. 해지 모바일 페이지 ▶바로가기  블루링크 고객센터 080-600-6000 서비스 가입/해지/변경 등 (안전 보안 서비스 24시간 제공) 평일 08:30 ~ 18:00 (주말/공휴일 휴무)
블루링크,[가입] 법인/리스/렌트 차량도 블루링크를 가입할 수 있나요?,"도난추적 서비스는 블루링크 고객센터에 요청하시면 됩니다. 단, 위치 정보 제공을 위해서는 반드시 경찰관서에 도난 신고를 하셔야만 합니다. 사전에 도난 신고가 접수되지 않은 경우에는 고객과 경찰서, 블루링크 고객센터 3자간 통화를 통해 고객님이 직접 도난 신고를 하실 수 있도록 도와 드립니다.  블루링크 고객센터 080-600-6000 서비스 가입/해지/변경 등 (안전 보안 서비스 24시간 제공) 평일 08:30 ~ 18:00 (주말/공휴일 휴무)"
블루링크,[서비스] 에어백 전개 자동통보 서비스는 어떻게 이용하나요?,"에어백 전개 자동통보 서비스는 고객님 차량의 에어백이 전개되면 블루링크 고객센터로 사고가 자동 접수되어 상담원이 고객님의 차량으로 사고 상황을 알아보기 위해 전화 드립니다. 고객님은 침착하게 사고 상황만 말씀해 주시면 119 및 보험사 등에 출동요청을 해 드리며, 만약 차량 탑승자의 부상 정도가 심해 사고 상황을 설명할 수 없는 경우에는 자동으로 긴급 출동을 요청하게 됩니다."
블루링크,[서비스] 블루링크 단말기는 어디에서 판매 하나요?,"블루링크 단말기는 차량 일체형으로 신규 차량구매시 옵션으로 구매하실 수 있으며, 단말기 만을 구입하여 기존에 보유하고 계신 차량에 별도로 장착 하실 수는 없습니다."
블루링크,[앱] 마이현대 앱은 어떻게 사용하나요?,마이현대 앱 설치 및 로그인 등 자세한 이용 안내는 아래 페이지를 참고해주세요.  마이현대 앱 이용 안내 ▶바로가기
블루링크,[서비스] 도난 경보 알림 서비스는 어떻게 이용하나요?,"도난 경보 알림 서비스는 차량의 도난 경보가 작동하게 되면 블루링크 센터로 신호가 자동으로 접수되어, 고객 휴대폰으로 긴급상황임을 알리는 문자 메시지를 전송해 드리는 서비스입니다. 단, 시동을 끈 후 48시간이 경과되면 도난 경보 알림 서비스가 제공되지 않습니다. 차량을 도난 당했을 경우에는 블루링크 고객센터로 도난 추적 서비스를 요청하시면 됩니다.  블루링크 고객센터 080-600-6000 서비스 가입/해지/변경 등 (안전 보안 서비스 24시간 제공) 평일 08:30 ~ 18:00 (주말/공휴일 휴무)"
블루링크,[서비스] 도난 추적 서비스 요청은 어떻게 해야 하나요?,"도난추적 서비스는 블루링크 고객센터에 요청하시면 됩니다. 단, 위치 정보 제공을 위해서는 반드시 경찰관서에 도난 신고를 하셔야만 합니다. 사전에 도난 신고가 접수되지 않은 경우에는 고객과 경찰서, 블루링크 고객센터 3자간 통화를 통해 고객님이 직접 도난 신고를 하실 수 있도록 도와 드립니다.  블루링크 고객센터 080-600-6000 서비스 가입/해지/변경 등 (안전 보안 서비스 24시간 제공) 평일 08:30 ~ 18:00 (주말/공휴일 휴무)"
블루링크,[서비스] 긴급 견인 출동 요원이 견인을 하면서 특수 장비가 필요한 경우 추가 비용이 드나요?,"도로를 이탈하거나 장애물 등으로 인해 자력 주행이 불가능하여 구난을 필요로 할 경우 긴급구난 서비스가 제공됩니다. 그러나 이 경우 별도의 구난장비 없이 견인차(렉카)로 구난이 가능한 경우에 한하며, 별도의 구난장비가 필요하거나 작업 난이도에 따라 추가비용을 지급하여야 합니다. 또한 구난작업 30분 초과시(현장도착에서 완료까지의 시간) 별도의 비용을 부담 하여야 합니다."
블루링크,"[서비스] 도난 추적 서비스 요청을 했는데, 추적이 불가능한 경우가 있나요?",도난 추적 서비스는 차량의 전류 공급 안정성을 위해 시동이 꺼진 후 아래의 시간 동안 지원 가능합니다. 따라서 시동이 꺼진 후 아래 시간 이상 경과하여 이후에 도난 차량의 재시동이 되지 않는 경우에는 차량의 위치추적이 불가능할 수 있습니다.  - 블루링크 1.0 차량 : 시동이 꺼진 시점으로부터 48시간(2015년 4차 정기 업데이트 시 96시간) - 블루링크 2.0 및 3.0 차량 : 시동이 꺼진 시점으로부터 96시간 - 10.25인치 이상의 내비게이션 장착 차량 : 시동이 꺼진 시점으로부터 168시간 - ccNC 장착 차량 : 시동이 꺼진 시점으로부터 336시간  - 과거 위치 정보 : 위치 정보 수집 시점으로부터 2주 이내
블루링크,[앱] 다른 사람에게 블루링크 가입 차량을 공유할 수 있나요?,마이현대 앱에서 블루링크 가입 차량 공유가 가능합니다. 자세한 공유 안내는 아래 페이지를 참고해주세요.  마이현대 앱 차량 공유 안내 ▶바로가기
현대 디지털 키,출고 이후 카드키만 따로 구매 가능한가요?,"NFC 카드키를 따로 구매하는 것은 가능하지만, 디지털키 옵션을 선택하지 않은 경우 등록은 불가능 합니다. 즉, 디지털키 옵션 선택한 경우에만 NFC 카드 키 등록이 가능합니다.  NFC 카드 키 구매는 전국 모비스 A/S망(오프라인) 및 블루멤버스 포인트몰(온라인)에서 구매할 수 있으며 카드 키 등록 방법은 크게 1. NFC 카드 키 등록 인증 → 2. 차량 내 카드 키 등록으로 이루어 집니다. 보다 자세한 절차는 위 ""NFC 카드키 등록은 어떻게 하나요?"" 문항을 참고 부탁드립니다."
현대 디지털 키,디지털 키 App이 계속 자동으로 꺼지는데 어떻게 하나요?,"App이 자동으로 종료되는 현상은 크게 2가지로 나뉩니다. 각 경우에 해당하는 항목을 참고하세요.  1. 최신 버전 미지원: 현대 디지털 키 App이 최신 버전이 아닐 경우, 간혹 App이 종료될 수 있습니다. 이 경우 구글 플레이 스토어에서 App을 최신 버전으로 업데이트 하시면 정상 사용 가능합니다.  2. 보안 프로그램 충돌: 현대 디지털 키 App의 보안 솔루션 기능에서 Rooting이 탐지 될 경우 App이 자동으로 종료될 수 있습니다. 이 경우 스마트폰의 Root 권한을 사용하는 App을 삭제하시면 디지털 키 정상 사용 가능합니다.  ■ 스마트폰의 Root 권한을 사용하는 App 확인 방법 구글 플레이 스토어 →“Root” 또는 “Superuser”로 검색 →해당 App 목록을 확인"
현대 디지털 키,"소유 차량 등록 확인은 어떻게 하나요?(중고차, 명의변경)","중고차 혹은 명의변경의 경우는 다음과 같은 절차로 차량 등록 가능합니다. (자동차 등록원부 상 ""대표 명의자""만 인증이 가능합니다.)  ■ 디지털 키 APP 메뉴 [차량 인증] - [디지털 키 차량 등록 확인] - [팝업된 정보 입력]"
현대 디지털 키,공동명의 차량인데 차량 등록이 안되는데 어떻게 해야 하나요?,"현대 디지털 키 App은 '자동차 등록원부' 상 차량의 대표 명의자(1명)로 등재가 되어 있는 소유주 분만 인증이 가능합니다. 공동명의의 경우 역시 차량의 대표 명의자는 1명으로 대표 명의자가 키를 발급받고, 공동 명의자에게 키를 공유하는 방식으로 사용이 가능합니다.  ■ 차량 대표 명의자 확인 방법 1) 인터넷 : 자동차 365(http://car365.go.kr)→ 자동차민원 대국민포털 → 등록원부발급(무료) → 차량 대표 명의자 확인"
현대 디지털 키,휴대폰 nfc기능이 인식이 안돼요. 어떻게 해야하나요?,금속 혹은 두꺼운 핸드폰 케이스를 사용하거나 무선 충전 패드 위에 금속류의 부착물을 장착한 경우에는 전파 간섭에 의해 현대 디지털 키 이용에 제한이 있을 수 있습니다. 이 경우 휴대폰 케이스 및 패드 부착물 제거하시면 nfc 정상 인식 및 동작 가능합니다.
현대 디지털 키,출고 이후 카드키만 따로 구매 가능한가요?,"NFC 카드키를 따로 구매하는 것은 가능하지만, 디지털키 옵션을 선택하지 않은 경우 등록은 불가능 합니다. 즉, 디지털키 옵션 선택한 경우에만 NFC 카드 키 등록이 가능합니다.  NFC 카드 키 구매는 전국 모비스 A/S망(오프라인) 및 블루멤버스 포인트몰(온라인)에서 구매할 수 있으며 카드 키 등록 방법은 크게 1. NFC 카드 키 등록 인증 → 2. 차량 내 카드 키 등록으로 이루어 집니다. 보다 자세한 절차는 위 ""NFC 카드키 등록은 어떻게 하나요?"" 문항을 참고 부탁드립니다."
현대 디지털 키,디지털 키 App이 계속 자동으로 꺼지는데 어떻게 하나요?,"App이 자동으로 종료되는 현상은 크게 2가지로 나뉩니다. 각 경우에 해당하는 항목을 참고하세요.  1. 최신 버전 미지원: 현대 디지털 키 App이 최신 버전이 아닐 경우, 간혹 App이 종료될 수 있습니다. 이 경우 구글 플레이 스토어에서 App을 최신 버전으로 업데이트 하시면 정상 사용 가능합니다.  2. 보안 프로그램 충돌: 현대 디지털 키 App의 보안 솔루션 기능에서 Rooting이 탐지 될 경우 App이 자동으로 종료될 수 있습니다. 이 경우 스마트폰의 Root 권한을 사용하는 App을 삭제하시면 디지털 키 정상 사용 가능합니다.  ■ 스마트폰의 Root 권한을 사용하는 App 확인 방법 구글 플레이 스토어 →“Root” 또는 “Superuser”로 검색 →해당 App 목록을 확인"
